{
  "schema_version": "jury.package_release_remediation_audit.v1",
  "audit_type": "retained-archive-drift-remediation",
  "package": "@sanogueralorenzo/jury",
  "failed": {
    "packageVersion": "0.1.0",
    "tarballName": "sanogueralorenzo-jury-0.1.0.tgz",
    "archiveEvidence": [
      "downstream-failure-gate.json",
      "failed-npm-view.json",
      "rollback-audit.json"
    ]
  },
  "replacement": {
    "packageVersion": "0.1.1",
    "archiveEvidence": [
      "replacement-downstream-gate.json",
      "replacement-npm-view.json",
      "replacement-patch-audit.json"
    ]
  },
  "drift": {
    "detectedBy": "fixtures:package-release:drift",
    "manifest": "retained-package-release-evidence-manifest.json",
    "evidence": [
      {
        "path": "downstream-failure-gate.json",
        "archive": "failed-publication",
        "failure": "archiveEvidence SHA-256 no longer matched the retained manifest",
        "remediation": "restore failed publication downstream rejection evidence before regenerating the manifest"
      },
      {
        "path": "replacement-downstream-gate.json",
        "archive": "replacement-patch",
        "failure": "archiveEvidence SHA-256 no longer matched the retained manifest",
        "remediation": "restore replacement patch downstream acceptance evidence before regenerating the manifest"
      }
    ]
  },
  "remediation": {
    "policy": "restore-before-regenerate",
    "restoredEvidence": [
      {
        "path": "downstream-failure-gate.json",
        "archive": "failed-publication",
        "source": "release record or incident archive"
      },
      {
        "path": "replacement-downstream-gate.json",
        "archive": "replacement-patch",
        "source": "release record or incident archive"
      }
    ],
    "regeneratedManifest": "retained-package-release-evidence-manifest.json",
    "diffReviewed": true
  },
  "verification": {
    "commands": [
      "npm --prefix jury run fixtures:package-release:check -- --fixture-dir <retained-evidence-dir> --verify-manifest <retained-manifest>",
      "node -e '<archiveEvidence SHA-256 helper>' <retained-evidence-dir> <retained-manifest>",
      "node -e '<dry-run identity helper>' <retained-evidence-dir> <retained-manifest>",
      "tmp=\"$(mktemp -d)\" && npm --prefix jury run fixtures:package-release:check -- --fixture-dir <retained-evidence-dir> --manifest-out \"$tmp/retained-package-release-evidence-manifest.json\" && diff -u <retained-manifest> \"$tmp/retained-package-release-evidence-manifest.json\"; rc=$?; rm -rf \"$tmp\"; exit $rc",
      "npm --prefix jury run fixtures:package-release:drift"
    ]
  },
  "approval": {
    "approvedBy": "release-maintainer@example.com",
    "approvedAt": "2026-05-23T00:00:00.000Z"
  },
  "record": {
    "location": "release record or incident archive",
    "summary": "Failed publication and replacement patch archive evidence were restored before the retained manifest was regenerated and approved."
  }
}
